{
  "schemaVersion": "1.0.0",
  "dashboardId": "DASH-GRAPH-AInvil-Productization-2026-07-06",
  "generatedAt": "2026-07-06T06:16:49.414Z",
  "projectName": "AInvil Productization",
  "currentVision": {
    "nodeId": "VISION-AInvil-Productization",
    "title": "AInvil reliable game production workflow",
    "status": "Confirmed",
    "owner": "Director Layer"
  },
  "currentMilestone": {
    "nodeId": "MILESTONE-DRC-MVP-FirstPlayable",
    "title": "Dungeon Recovery Company first playable vertical slice",
    "status": "In Progress",
    "owner": "Orchestrator"
  },
  "activeFeature": {
    "nodeId": "FEAT-DRC-PROC-RecoveryJob",
    "title": "Procedural Recovery Job",
    "status": "Implemented",
    "owner": "GDD Agent"
  },
  "healthSummary": {
    "designHealth": "Yellow",
    "implementationHealth": "Yellow",
    "documentationHealth": "Yellow",
    "validationCoverage": "Red",
    "technicalDebt": "Yellow",
    "productionRisk": "Yellow",
    "summary": "Operational source-of-truth has been reset from the example graph. Unity Bridge and Play Mode evidence remain blocked until live Unity connectivity is restored."
  },
  "validationCoverage": {
    "Not Checked": 1,
    "Document Review": 0,
    "Static Analysis": 2,
    "Unity Inspection": 0,
    "Compile Verified": 0,
    "Play Mode Verified": 0,
    "Runtime Tested": 0,
    "User Confirmed": 0
  },
  "implementedFeatures": [
    "FEAT-DRC-SPACE-001"
  ],
  "validatedFeatures": [
    "FEAT-E2E-HappyPath-001",
    "FEAT-DRC-MVP-FirstRecoveryJob",
    "FEAT-DRC-PROC-RecoveryJob",
    "FEAT-DRC-SPACE-001"
  ],
  "blockedTasks": [
    "TASK-E2E-004",
    "AC-E2E-002"
  ],
  "openQuestions": [],
  "latestBenchmarkReport": "benchmarks/reports/latest-benchmark-report.json",
  "latestLiveHarnessReport": "harness/reports/latest-live-harness-report.json",
  "latestExecutionRecord": "workflow/runs/latest.json",
  "productizationStatus": {
    "reportId": "PRODSTAT-2026-07-06T06-16-49-297Z",
    "decision": "Release Candidate",
    "graphClassification": "Operational",
    "releaseBlockerCount": 0,
    "featureCounts": {
      "Verified": 1,
      "Spec-only": 2,
      "Partial": 14,
      "Deprecated/Sample": 2
    },
    "e2eCounts": {
      "Spec-only": 1,
      "Partial": 5,
      "Verified": 4
    },
    "operationalValidation": {
      "scenarioCount": 6,
      "scenarios": [
        {
          "id": "ainvil_bridge_smoke_operational",
          "title": "AInvil Unity Bridge operational smoke validation",
          "evidenceOutputPath": "validation/evidence/EVID-ainvil-bridge-smoke-operational-latest.json"
        },
        {
          "id": "ainvil_compile_gate_blocks_playmode_on_compile_error",
          "title": "AInvil compile gate blocks Play Mode on compile error",
          "evidenceOutputPath": "validation/evidence/EVID-ainvil-compile-gate-blocks-playmode-latest.json"
        },
        {
          "id": "dungeon_recovery_first_playable_e2e",
          "title": "Dungeon Recovery Company first playable recovery job E2E",
          "evidenceOutputPath": "validation/evidence/EVID-dungeon-recovery-first-playable-e2e-latest.json"
        },
        {
          "id": "dungeon_recovery_procedural_recovery_job_e2e",
          "title": "Dungeon Recovery Company procedural recovery job E2E",
          "evidenceOutputPath": "validation/evidence/EVID-dungeon-recovery-procedural-recovery-job-e2e-latest.json"
        },
        {
          "id": "dungeon_recovery_procedural_space_quality_validation",
          "title": "Dungeon Recovery Company procedural space quality validation",
          "evidenceOutputPath": "validation/evidence/EVID-dungeon-recovery-procedural-space-quality-latest.json"
        },
        {
          "id": "dungeon_recovery_procedural_visual_validation",
          "title": "Dungeon Recovery Company procedural visual validation",
          "evidenceOutputPath": "validation/evidence/EVID-dungeon-recovery-procedural-visual-validation-latest.json"
        }
      ],
      "latestEvidence": {
        "evidenceId": "EVID-dungeon_recovery_procedural_space_quality_validation-2026-07-06T06-16-24-142Z",
        "scenarioId": "dungeon_recovery_procedural_space_quality_validation",
        "classification": "Operational",
        "status": "Passed",
        "validationLevel": "Play Mode Verified",
        "failureClass": "None",
        "path": "validation/evidence/EVID-dungeon-recovery-procedural-space-quality-latest-passed.json"
      }
    },
    "productMvpWorkflow": {
      "scenarioExists": true,
      "scenarioId": "dungeon_recovery_first_playable_e2e",
      "category": "ProductMvp",
      "validationType": "UnityFeatureE2E",
      "status": "Passed",
      "humanPlayabilityReview": {
        "status": "Passed",
        "reportPath": "reports/dungeon_recovery_first_playable_playability_review.json",
        "remainingIssues": [
          "This is not a finished game.",
          "Art, sound, and recovery presentation remain placeholder-level.",
          "Tutorial flow is still simple instructional UI rather than a full game-like onboarding sequence.",
          "Next-job, reward, and company management loops are not implemented yet."
        ]
      },
      "buildVerification": {
        "status": "Passed",
        "outputPath": "E:/wiseongjun/ProgrammingNAssignment/GameDesigner/plugins/ainvil/reports/builds/dungeon_recovery_first_playable/DungeonRecoveryFirstPlayable.exe",
        "reportPath": "reports/dungeon_recovery_first_playable_build_verification.json",
        "failureReason": null
      },
      "readyCandidate": true,
      "humanPlayableFirstBuildCandidate": true,
      "productMvpFirstPlayableVerified": true,
      "latestEvidence": {
        "evidenceId": "EVID-dungeon_recovery_first_playable_e2e-2026-07-04T19-50-44-904Z",
        "status": "Passed",
        "validationLevel": "Play Mode Verified",
        "totalRecoveryTargetCount": 3,
        "afterThirdRecoveryCount": 3,
        "isJobComplete": true,
        "progressText": "Recovered: 3 / 3\nJob Complete",
        "path": "validation/evidence/EVID-dungeon-recovery-first-playable-e2e-latest.json"
      },
      "latestHarness": null,
      "nextAction": "Treat as Product MVP Ready Candidate evidence; continue manual playability and public install gates separately."
    },
    "releaseLevel": {
      "coreReleaseReady": false,
      "coreRcReproducibilityVerified": true,
      "canonicalUnityBridgePackageVerified": true,
      "productMvpWorkflow": "Passed",
      "humanPlayabilityReview": "Passed",
      "buildVerification": "Passed",
      "productMvpReadyCandidate": true,
      "humanPlayableFirstBuildCandidate": true,
      "productMvpFirstPlayableVerified": true,
      "firstGameplayLoop": "Verified",
      "proceduralRecoveryJob": "Passed",
      "proceduralGenerationVerified": true,
      "visualValidation": "Passed",
      "proceduralSpaceQuality": "Passed",
      "compileGate": "Passed",
      "compileGateSafety": "Passed",
      "playModeBlockedOnCompileError": true,
      "screenshotEvidenceAvailable": true,
      "missingShaderSuspected": false,
      "cameraFramingCheck": "Passed",
      "publicReleaseReady": false
    }
  },
  "productionCoreReview": {
    "evaluationId": "PCORE-EVAL-2026-07-06T06-16-48-895Z",
    "reviewedGateId": "GATE-REVIEW-001",
    "previousStatus": "Revalidation Required",
    "newStatus": "Revalidation Required",
    "resolvedChangeCount": 7,
    "remainingChangeCount": 2,
    "remainingChanges": [
      {
        "id": "PCORE-APPROVAL-PRODUCTIZATION",
        "status": "Revalidation Required",
        "summary": "Productization has only environment revalidation blockers, not product requested changes.",
        "connectedArtifacts": [
          "reports/productization_status_report.json"
        ],
        "nextAction": "Resolve non-review productization blockers and regenerate the productization report."
      },
      {
        "id": "PCORE-APPROVAL-RELEASE",
        "status": "Revalidation Required",
        "summary": "Release readiness has only environment revalidation blockers, not product requested changes.",
        "connectedArtifacts": [
          "reports/release_readiness_report.json"
        ],
        "nextAction": "Resolve non-review release blockers and regenerate release readiness."
      }
    ],
    "evidenceUsed": [
      {
        "kind": "Review Record",
        "summary": "Production Core readiness review record.",
        "path": "reviews/production_core_readiness_review.json"
      },
      {
        "kind": "Productization Report",
        "summary": "Productization status and operational validation summary.",
        "path": "reports/productization_status_report.json"
      },
      {
        "kind": "Release Readiness Report",
        "summary": "Release gate state before Production Core review reevaluation.",
        "path": "reports/release_readiness_report.json"
      },
      {
        "kind": "Onboarding Doctor Report",
        "summary": "Unity Bridge health and compile health checks.",
        "path": "reports/onboarding_doctor_report.json"
      },
      {
        "kind": "Live Harness Report",
        "summary": "Latest operational live harness execution.",
        "path": "harness/reports/latest-live-harness-report.json"
      },
      {
        "kind": "Validation Evidence",
        "summary": "Latest non-sample operational smoke evidence.",
        "path": "validation/evidence/EVID-ainvil-bridge-smoke-operational-latest.json"
      }
    ]
  },
  "nextRecommendedAction": {
    "actionId": "NEXT-DRC-PROC-Validate",
    "title": "Run procedural recovery job E2E validation for seeds 1001, 2026, and 7777.",
    "owner": "Input Agent",
    "status": "Planned",
    "reason": "Procedural generation must prove deterministic layouts, reachable targets, recovery completion, and zero console errors before further gameplay expansion.",
    "referencesNodeId": "FEAT-DRC-PROC-RecoveryJob",